{
  "metadata": {
    "version": "0.1.0",
    "fecha": "2026-08-30",
    "fuentes": [
      "normativa/Normativa - indice y vigencias.docx",
      "tramites-procesos/Tramites piloto - indice.docx",
      "tramites-procesos/Catalogo de tramites (Portal).xlsx",
      "tramites-procesos/Tramites piloto - pasos y normativa.xlsx"
    ],
    "convenciones": {
      "puntaje": "Los puntajes del mock son manuales y solo comparables dentro de cada respuesta.",
      "vigencia_estado": [
        "vigente",
        "no_vigente",
        "prorrogada"
      ],
      "nivel_identificacion": [
        "sin_clave",
        "clave_simple",
        "presencial_o_validacion_manual"
      ]
    }
  },
  "consultar_normativa": [
    {
      "id": "N01",
      "request": {
        "texto": "baja de automotor por venta",
        "filtros": {
          "vigente_a": "2026-08-30",
          "tributo": "automotor"
        },
        "k": 3
      },
      "response": [
        {
          "texto": "La denuncia impositiva de venta ante la DGR es causal de baja si no registra deudas del gravamen a la fecha, si existe denuncia de venta ante el Registro Nacional, si se identifica fehacientemente al adquirente y si se acompana la documentacion que determine la Autoridad de Aplicacion.",
          "cita": "Ord. 3500, Anexo Impuesto Automotor, art. 12 inc. c",
          "cadena_jerarquica": [
            "Ordenanza 3500",
            "Anexo Impuesto Automotor",
            "Articulo 12",
            "Inciso c"
          ],
          "vigencia": {
            "estado": "vigente",
            "desde": null,
            "hasta": null,
            "derogada_por": null
          },
          "puntaje": 0.92,
          "fuente": {
            "norma_id": "ORD-3500",
            "titulo": "Ordenanza Fiscal (Anexos I a XV)",
            "archivo": "ORD-3500 - Ordenanza Fiscal (vigente).pdf"
          }
        },
        {
          "texto": "La baja de automotor se encadena con la verificacion de libre deuda porque el articulo 12 inciso c exige no registrar deudas del gravamen a la fecha de la denuncia.",
          "cita": "Ord. 3500, Anexo Impuesto Automotor, art. 12 inc. c",
          "cadena_jerarquica": [
            "Ordenanza 3500",
            "Anexo Impuesto Automotor",
            "Articulo 12",
            "Inciso c"
          ],
          "vigencia": {
            "estado": "vigente",
            "desde": null,
            "hasta": null,
            "derogada_por": null
          },
          "puntaje": 0.81,
          "fuente": {
            "norma_id": "ORD-3500",
            "titulo": "Ordenanza Fiscal (Anexos I a XV)",
            "archivo": "ORD-3500 - Ordenanza Fiscal (vigente).pdf"
          }
        }
      ]
    },
    {
      "id": "N02",
      "request": {
        "texto": "denuncia de venta automotor",
        "filtros": {
          "vigente_a": "2026-08-30",
          "tributo": "automotor"
        },
        "k": 3
      },
      "response": [
        {
          "texto": "La denuncia impositiva de venta ante la DGR limita la responsabilidad del transmitente cuando cumple los requisitos del articulo 12 inciso c.",
          "cita": "Ord. 3500, Anexo Impuesto Automotor, art. 12 inc. c",
          "cadena_jerarquica": [
            "Ordenanza 3500",
            "Anexo Impuesto Automotor",
            "Articulo 12",
            "Inciso c"
          ],
          "vigencia": {
            "estado": "vigente",
            "desde": null,
            "hasta": null,
            "derogada_por": null
          },
          "puntaje": 0.9,
          "fuente": {
            "norma_id": "ORD-3500",
            "titulo": "Ordenanza Fiscal (Anexos I a XV)",
            "archivo": "ORD-3500 - Ordenanza Fiscal (vigente).pdf"
          }
        },
        {
          "texto": "La falsedad en la declaracion jurada del articulo 12 inciso c inhibe la limitacion de responsabilidad. Si un error imputable al denunciante impide notificar al nuevo responsable, los efectos de la denuncia se suspenden hasta que sea salvado.",
          "cita": "Ord. 3500, Anexo Impuesto Automotor, art. 13",
          "cadena_jerarquica": [
            "Ordenanza 3500",
            "Anexo Impuesto Automotor",
            "Articulo 13"
          ],
          "vigencia": {
            "estado": "vigente",
            "desde": null,
            "hasta": null,
            "derogada_por": null
          },
          "puntaje": 0.86,
          "fuente": {
            "norma_id": "ORD-3500",
            "titulo": "Ordenanza Fiscal (Anexos I a XV)",
            "archivo": "ORD-3500 - Ordenanza Fiscal (vigente).pdf"
          }
        }
      ]
    },
    {
      "id": "N03",
      "request": {
        "texto": "libre deuda para tramites municipales",
        "filtros": {
          "vigente_a": "2026-08-30"
        },
        "k": 3
      },
      "response": [
        {
          "texto": "Ninguna oficina publica municipal ni organismo autarquico puede dar curso a tramites sobre transferencia de bienes, negocios, activos y pasivos sin acreditar la inexistencia de deudas fiscales mediante certificacion de la Autoridad de Aplicacion.",
          "cita": "Ord. 3500, Parte General, art. 37",
          "cadena_jerarquica": [
            "Ordenanza 3500",
            "Parte General",
            "Articulo 37"
          ],
          "vigencia": {
            "estado": "vigente",
            "desde": null,
            "hasta": null,
            "derogada_por": null
          },
          "puntaje": 0.91,
          "fuente": {
            "norma_id": "ORD-3500",
            "titulo": "Ordenanza Fiscal (Anexos I a XV)",
            "archivo": "ORD-3500 - Ordenanza Fiscal (vigente).pdf"
          }
        },
        {
          "texto": "Las instituciones bancarias no pueden conceder ni renovar creditos sin constancia de situacion fiscal regular expedida por la Direccion.",
          "cita": "Ord. 3500, Parte General, art. 35",
          "cadena_jerarquica": [
            "Ordenanza 3500",
            "Parte General",
            "Articulo 35"
          ],
          "vigencia": {
            "estado": "vigente",
            "desde": null,
            "hasta": null,
            "derogada_por": null
          },
          "puntaje": 0.84,
          "fuente": {
            "norma_id": "ORD-3500",
            "titulo": "Ordenanza Fiscal (Anexos I a XV)",
            "archivo": "ORD-3500 - Ordenanza Fiscal (vigente).pdf"
          }
        }
      ]
    },
    {
      "id": "N04",
      "request": {
        "texto": "valuacion o base imponible automotor",
        "filtros": {
          "tributo": "automotor"
        },
        "k": 2
      },
      "response": [
        {
          "texto": "En el impuesto automotor, los articulos 1 a 3 regulan el hecho imponible, la radicacion y la base de calculo segun la valuacion del DNRPA.",
          "cita": "Ord. 3500, Anexo Impuesto Automotor, arts. 1 a 3",
          "cadena_jerarquica": [
            "Ordenanza 3500",
            "Anexo Impuesto Automotor",
            "Articulos 1 a 3"
          ],
          "vigencia": {
            "estado": "vigente",
            "desde": null,
            "hasta": null,
            "derogada_por": null
          },
          "puntaje": 0.94,
          "fuente": {
            "norma_id": "ORD-3500",
            "titulo": "Ordenanza Fiscal (Anexos I a XV)",
            "archivo": "ORD-3500 - Ordenanza Fiscal (vigente).pdf"
          }
        }
      ]
    },
    {
      "id": "N05",
      "request": {
        "texto": "alicuota o tasa automotor",
        "filtros": {
          "vigente_a": "2026-08-30",
          "tributo": "automotor"
        },
        "k": 3
      },
      "response": [
        {
          "texto": "La Ordenanza Fiscal define el hecho imponible, la radicacion y la base de calculo del impuesto automotor; la Ordenanza Tarifaria vigente es la que completa el monto aplicable para el periodo correspondiente.",
          "cita": "Ord. 3500, Anexo Impuesto Automotor, arts. 1 a 3",
          "cadena_jerarquica": [
            "Ordenanza 3500",
            "Anexo Impuesto Automotor",
            "Articulos 1 a 3"
          ],
          "vigencia": {
            "estado": "vigente",
            "desde": null,
            "hasta": null,
            "derogada_por": null
          },
          "puntaje": 0.79,
          "fuente": {
            "norma_id": "ORD-3500",
            "titulo": "Ordenanza Fiscal (Anexos I a XV)",
            "archivo": "ORD-3500 - Ordenanza Fiscal (vigente).pdf"
          }
        },
        {
          "texto": "La Ordenanza Tarifaria 2016 es la norma tarifaria vigente del corpus base y debe consultarse junto con sus modificatorias para determinar el componente economico aplicable.",
          "cita": "Ord. 5069, art. 1 y Anexo I",
          "cadena_jerarquica": [
            "Ordenanza 5069",
            "Articulo 1",
            "Anexo I"
          ],
          "vigencia": {
            "estado": "vigente",
            "desde": "2016-06-02",
            "hasta": null,
            "derogada_por": null
          },
          "puntaje": 0.75,
          "fuente": {
            "norma_id": "ORD-5069",
            "titulo": "Ordenanza Tarifaria 2016 (Anexos I a XVIII)",
            "archivo": "ORD-5069 - Ordenanza Tarifaria 2016.pdf"
          }
        }
      ],
      "notas": [
        "El detalle tarifario fino de 5069 y sus modificatorias sigue pendiente de relevamiento exhaustivo."
      ]
    },
    {
      "id": "N06",
      "request": {
        "texto": "ordenanza tarifaria 2009 automotor",
        "filtros": {
          "vigente_a": "2010-06-01",
          "tributo": "automotor"
        },
        "k": 2
      },
      "response": [
        {
          "texto": "Para una consulta fechada en 2010, la referencia tarifaria del corpus base es la Ordenanza Tarifaria 2009, todavia no abrogada a esa fecha.",
          "cita": "Ord. 3501, art. 1 y Anexo Tarifario",